<?xml version="1.0" encoding="UTF-8"?>
<!DOCTYPE cluster SYSTEM "servers.dtd">
<cluster>
    <groups>
        <group>
            <name>group1</name>
            <servers>
                <server>
                    <id>1</id>
                    <description></description>
                    <host>localhost</host>
                    <port>3306</port>
                    <db_name>test_1</db_name>
                    <user>root</user>
                    <password></password>
                    <online>true</online>
                    <capacity>1000000</capacity>
                    <!-- 最大容量 -->
                    <size>123456</size>
                    <!-- 当前容量 -->
                </server>
                <server>
                    <id>2</id>
                    <description></description>
                    <host>localhost</host>
                    <port>3306</port>
                    <db_name>test_2</db_name>
                    <user>root</user>
                    <password></password>
                    <online>true</online>
                    <capacity>1000000</capacity>
                    <!-- 最大容量 -->
                    <size>654321</size>
                    <!-- 当前容量 -->
                </server>
                <server>
                    <id>3</id>
                    <description></description>
                    <host>localhost</host>
                    <port>3306</port>
                    <db_name>test_3</db_name>
                    <user>root</user>
                    <password></password>
                    <online>true</online>
                    <capacity>1000000</capacity>
                    <!-- 最大容量 -->
                    <size>654321</size>
                    <!-- 当前容量 -->
                </server>
            </servers>
        </group>
    </groups>
    <tables>
        <table>
            <table_name>user</table_name>
            <split_columns> <!-- 分表字段 -->
                <column>id</column>
            </split_columns>
            <master_group>group1</master_group>
            <brother_group>group1</brother_group>
            <!-- 热备份的group -->
        </table>
        <table>
            <table_name>account</table_name>
            <split_columns>
                <column>id</column>
            </split_columns>
            <master_group>group1</master_group>
            <brother_group>group1</brother_group>
        </table>
    </tables>
</cluster>
